{
	"$schema": "http://json-schema.org/draft-07/schema#",
	"title": "Portfolio sources manifest",
	"description": "Last-synced git fingerprints for each portfolio source repo. Written by `drift sync` (`scripts/check-drift.js`).",
	"type": "object",
	"required": ["lastSyncedAt", "sources"],
	"additionalProperties": false,
	"properties": {
		"$schema": {
			"type": "string"
		},
		"_note": {
			"type": "string"
		},
		"_firstCommitNote": {
			"type": "string"
		},
		"firstCommitProvisional": {
			"type": "boolean",
			"description": "True while commitAnyRoot values are provisional estimates. Set to false after a real `drift sync`."
		},
		"lastSyncedAt": {
			"type": "string",
			"format": "date",
			"description": "ISO date of the last `drift sync` run (YYYY-MM-DD)."
		},
		"sources": {
			"type": "object",
			"description": "Keyed by project slug (matches ProjectSlug in types.ts).",
			"additionalProperties": {
				"$ref": "#/$defs/SyncedSource"
			}
		},
		"enriched": {
			"type": "object",
			"description": "Keyed by project slug. GitHub-sourced facts git cannot see (archived state, homepage URL). Written by `drift enrich` only; `drift sync` never touches this section and stays offline.",
			"additionalProperties": {
				"$ref": "#/$defs/EnrichedSource"
			}
		}
	},
	"$defs": {
		"EnrichedSource": {
			"type": "object",
			"additionalProperties": false,
			"description": "GitHub-sourced facts for one source repo, from `gh repo view`. All fields optional except enrichedAt — populated by `drift enrich`, never by `drift sync`.",
			"properties": {
				"githubArchived": {
					"type": "boolean",
					"description": "GitHub's own isArchived flag. Written on every successfully-enriched record, including false — false is a real observed answer, distinct from never having checked (see enrichedAt)."
				},
				"githubHomepageUrl": {
					"type": "string",
					"description": "GitHub's homepage URL for the repo. Key is omitted entirely when gh reports an empty string — an empty string is not a URL and is never stored."
				},
				"enrichedAt": {
					"type": "string",
					"format": "date",
					"description": "ISO date (YYYY-MM-DD) this record was last checked against GitHub. Distinguishes \"checked, nothing found\" from \"never checked\"."
				},
				"enrichError": {
					"type": "string",
					"description": "Set instead of githubArchived/githubHomepageUrl when the repo could not be resolved on GitHub (deleted, renamed or private). Recorded as data rather than silently omitted."
				}
			},
			"required": ["enrichedAt"]
		},
		"SyncedSource": {
			"type": "object",
			"additionalProperties": false,
			"description": "Git fingerprint for one source repo. All fields optional \u2014 populated incrementally by check-drift.js. Property order matches FINGERPRINT_FIELDS in check-drift.js so Object.keys() derivation preserves field-drift display order.",
			"properties": {
				"commitHead": {
					"type": "string",
					"description": "Short SHA of HEAD at last sync."
				},
				"measuredRef": {
					"type": "string",
					"description": "Git ref the fingerprint was measured against (resolved default branch, e.g. 'main', or 'HEAD' when no default branch could be resolved). Metadata only; excluded from drift comparison via DRIFT_SKIP_FIELDS."
				},
				"commitsAny": {
					"type": "integer",
					"minimum": 0,
					"description": "All-authors commit count, lifetime."
				},
				"commitsAnyRecent": {
					"type": "integer",
					"minimum": 0,
					"description": "All-authors commit count, trailing 4 weeks."
				},
				"commitsMe": {
					"type": "integer",
					"minimum": 0,
					"description": "Jason-authored commit count, lifetime."
				},
				"commitsMeRecent": {
					"type": "integer",
					"minimum": 0,
					"description": "Jason-authored commit count, trailing 4 weeks."
				},
				"commitsHuman": {
					"type": "integer",
					"minimum": 0,
					"description": "Commit count excluding non-human authors (CI bots, AI agents), lifetime. The denominator role inference divides by: `commits` counts bot commits as co-authorship, which reads solo work as a team project."
				},
				"authorsDistinct": {
					"type": "integer",
					"minimum": 0,
					"description": "Distinct commit authors by email, all authors including bots."
				},
				"authorsDistinctHuman": {
					"type": "integer",
					"minimum": 0,
					"description": "Distinct human commit authors by email. A value of 1 proves solo work regardless of commit share."
				},
				"commitMeRoot": {
					"type": "boolean",
					"description": "Whether Jason authored the repository's root commit: originated the project rather than joined it."
				},
				"commitAnyLast": {
					"type": "string",
					"format": "date",
					"description": "ISO date of the most recent commit."
				},
				"commitMeLast": {
					"type": "string",
					"format": "date",
					"description": "ISO date of Jason's most recent commit. Pairs with commitAnyRoot (also author-scoped) for a single-scope span."
				},
				"commitAnyRoot": {
					"type": "string",
					"format": "date",
					"description": "ISO date of Jason's earliest commit (his inception on the project), falling back to the repo root commit when he authored none."
				},
				"spanMonthsActive": {
					"type": "integer",
					"minimum": 0,
					"description": "Distinct calendar months containing at least one Jason-authored commit. With spanMonthsAll, distinguishes sustained work from a burst followed by dormancy."
				},
				"spanMonthsAll": {
					"type": "integer",
					"minimum": 0,
					"description": "Calendar months from Jason's first to last commit, inclusive."
				},
				"spanGapMaxDays": {
					"type": "integer",
					"minimum": 0,
					"description": "Longest run of consecutive days with no Jason-authored commit, inside his own span. Makes intra-span dormancy detectable where the first/last endpoints alone cannot."
				},
				"detectedLanguages": {
					"type": "array",
					"items": {
						"type": "string"
					},
					"description": "Languages present in the repo, ordered by file count. Advisory only \u2014 language tags are hand-curated."
				},
				"linesAny": {
					"type": "integer",
					"minimum": 0,
					"description": "Total lines across tracked source files, all authors."
				},
				"linesMeAdded": {
					"type": "integer",
					"minimum": 0,
					"description": "Lines added by Jason, lifetime."
				},
				"linesMeRemoved": {
					"type": "integer",
					"minimum": 0,
					"description": "Lines removed by Jason, lifetime."
				},
				"linesAnyAdded": {
					"type": "integer",
					"minimum": 0,
					"description": "Lines added by all authors, lifetime."
				},
				"linesAnyRemoved": {
					"type": "integer",
					"minimum": 0,
					"description": "Lines removed by all authors, lifetime."
				},
				"linesMeAddedRecent": {
					"type": "integer",
					"minimum": 0,
					"description": "Lines added by Jason, trailing 4 weeks."
				},
				"linesMeRemovedRecent": {
					"type": "integer",
					"minimum": 0,
					"description": "Lines removed by Jason, trailing 4 weeks."
				},
				"linesAnyAddedRecent": {
					"type": "integer",
					"minimum": 0,
					"description": "Lines added by all authors, trailing 4 weeks."
				},
				"linesAnyRemovedRecent": {
					"type": "integer",
					"minimum": 0,
					"description": "Lines removed by all authors, trailing 4 weeks."
				},
				"urlRepo": {
					"type": "string",
					"description": "HTTPS URL of the primary git remote (git remote get-url origin), normalised from any SSH form. Used as the default repoUrl for un-authored projects."
				},
				"urlsRepoCompanion": {
					"type": "array",
					"items": {
						"type": "string"
					},
					"description": "HTTPS URLs of companion repositories, in tracked topology order."
				},
				"detectedRuntime": {
					"type": "array",
					"items": {
						"type": "string"
					},
					"description": "Runtime identity strings detected by the dependency-manifest parser (e.g. 'bun', 'deno', 'node', 'python', 'go'). Keys match RUNTIME_TAGS in tag-taxonomy.js."
				},
				"detectedDatabase": {
					"type": "array",
					"items": {
						"type": "string"
					},
					"description": "Database package identities detected by the dependency-manifest parser (e.g. 'pg', '@supabase/supabase-js'). Keys match DATABASE_TAGS in tag-taxonomy.js."
				},
				"detectedFramework": {
					"type": "array",
					"items": {
						"type": "string"
					},
					"description": "Framework package identities detected by the dependency-manifest parser (e.g. 'svelte', '@sveltejs/kit', 'react'). Keys match FRAMEWORK_TAGS in tag-taxonomy.js."
				},
				"detectedTechFirstSeen": {
					"type": "object",
					"additionalProperties": {
						"type": "string",
						"format": "date"
					},
					"description": "First-introduced date (YYYY-MM-DD) per detected tech identity, keyed by the same identity strings used in runtime/framework/database arrays (e.g. 'svelte-5', '@sveltejs/kit', 'bun'). Populated by a git pickaxe/file-add search against package.json, lockfiles and config files at drift sync time. Source-grep-only signals (e.g. inkjs when detected only via source import) are intentionally absent here and fall back to commitAnyRoot downstream. Excluded from drift comparison via DRIFT_SKIP_FIELDS (object identity would otherwise always read as drifted)."
				},
				"detectedTechLastSeen": {
					"type": "object",
					"additionalProperties": {
						"type": "string",
						"format": "date"
					},
					"description": "Retirement date (YYYY-MM-DD) per tech identity that has left detection, keyed the same way as detectedTechFirstSeen (5DR.31). A sibling map, not a replacement: an identity present here keeps its entry in detectedTechFirstSeen too, so adoption history is append-only rather than erased on a major migration (e.g. Svelte 4 to 5). Present only for identities no longer detected; a live identity never appears here. Dated to the sync that first noticed the identity's absence, not the commit that actually removed it (see the follow-up task for exact removal-dating via a reverse pickaxe). Excluded from drift comparison via DRIFT_SKIP_FIELDS, for the same object-identity reason as detectedTechFirstSeen."
				}
			}
		}
	}
}
