{
	"$schema": "../../../scripts/sources.schema.json",
	"_note": "Last-synced fingerprints for each source repo. Run `bun run scripts/check-drift.js sync` to update. Local paths live in sources.local.json (gitignored).",
	"_firstCommitNote": "commitAnyRoot values are PROVISIONAL estimates derived from commit volume and commitAnyLast, seeded so the /toolkit adoption timeline can render before a real sync. `bun run scripts/check-drift.js sync` overwrites them with true root-commit dates. After syncing, set firstCommitProvisional to false.",
	"firstCommitProvisional": false,
	"lastSyncedAt": "2026-10-04",
	"sources": {
		"baby-names": {
			"commitHead": "9f5bdf1",
			"commitsAny": 5,
			"commitsAnyRecent": 0,
			"commitsMe": 5,
			"commitsMeRecent": 0,
			"commitAnyLast": "2026-03-14",
			"commitAnyRoot": "2026-03-14",
			"detectedLanguages": ["TypeScript", "Svelte", "JavaScript", "CSS", "HTML"],
			"linesAny": 2165,
			"linesMeAdded": 2815,
			"linesMeRemoved": 0,
			"linesAnyAdded": 2815,
			"linesAnyRemoved": 0,
			"linesMeAddedRecent": 0,
			"linesMeRemovedRecent": 0,
			"linesAnyAddedRecent": 0,
			"linesAnyRemovedRecent": 0,
			"urlRepo": "https://github.com/JasonWarrenUK/baby-names",
			"detectedRuntime": ["bun"],
			"detectedFramework": ["@sveltejs/kit", "svelte-5", "vite"],
			"measuredRef": "main",
			"detectedTechFirstSeen": {
				"bun": "2026-03-14",
				"@sveltejs/kit": "2026-03-14",
				"svelte-5": "2026-03-14",
				"vite": "2026-03-14"
			},
			"commitsHuman": 5,
			"authorsDistinct": 1,
			"authorsDistinctHuman": 1,
			"commitMeRoot": true,
			"commitMeLast": "2026-03-14",
			"spanMonthsActive": 1,
			"spanMonthsAll": 1,
			"spanGapMaxDays": 0
		},
		"chirpdb": {
			"commitHead": "9f8ece3e",
			"commitsAny": 2744,
			"commitsAnyRecent": 809,
			"commitsMe": 1311,
			"commitsMeRecent": 465,
			"commitAnyLast": "2026-10-02",
			"commitAnyRoot": "2026-06-08",
			"detectedLanguages": [
				"Python",
				"SQL",
				"TypeScript",
				"Svelte",
				"Shell",
				"HTML",
				"JavaScript",
				"CSS"
			],
			"linesAny": 158046,
			"linesMeAdded": 227615,
			"linesMeRemoved": 114346,
			"linesAnyAdded": 412097,
			"linesAnyRemoved": 162895,
			"linesMeAddedRecent": 55145,
			"linesMeRemovedRecent": 13046,
			"linesAnyAddedRecent": 89137,
			"linesAnyRemovedRecent": 22979,
			"urlRepo": "https://github.com/ZigZag-Technology/CHIRPdb",
			"detectedRuntime": ["bun", "python"],
			"detectedFramework": ["@sveltejs/kit", "svelte-5", "vite", "tailwindcss-4", "fastapi"],
			"measuredRef": "main",
			"detectedDatabase": ["supabase-py", "supabase-postgres"],
			"detectedTechFirstSeen": {
				"bun": "2026-09-18",
				"@sveltejs/kit": "2026-09-17",
				"svelte-5": "2026-09-17",
				"vite": "2026-09-17",
				"python": "2026-02-23",
				"fastapi": "2026-02-23",
				"tailwindcss-4": "2026-09-22"
			},
			"commitsHuman": 2738,
			"authorsDistinct": 10,
			"authorsDistinctHuman": 9,
			"commitMeRoot": false,
			"commitMeLast": "2026-10-02",
			"spanMonthsActive": 5,
			"spanMonthsAll": 5,
			"spanGapMaxDays": 16
		},
		"code-arcana": {
			"commitHead": "e3ed06f",
			"commitsAny": 43,
			"commitsAnyRecent": 20,
			"commitsMe": 43,
			"commitsMeRecent": 20,
			"commitAnyLast": "2026-10-02",
			"commitAnyRoot": "2026-06-11",
			"detectedLanguages": ["TypeScript", "Svelte", "HTML", "JavaScript", "CSS"],
			"linesAny": 5124,
			"linesMeAdded": 20883,
			"linesMeRemoved": 12186,
			"linesAnyAdded": 20883,
			"linesAnyRemoved": 12186,
			"linesMeAddedRecent": 2758,
			"linesMeRemovedRecent": 4255,
			"linesAnyAddedRecent": 2758,
			"linesAnyRemovedRecent": 4255,
			"urlRepo": "https://github.com/JasonWarrenUK/code-arcana",
			"detectedRuntime": ["deno"],
			"detectedFramework": ["@sveltejs/kit", "svelte-5", "vite"],
			"measuredRef": "main",
			"commitsHuman": 43,
			"authorsDistinct": 1,
			"authorsDistinctHuman": 1,
			"commitMeRoot": true,
			"commitMeLast": "2026-10-02",
			"spanMonthsActive": 4,
			"spanMonthsAll": 5,
			"spanGapMaxDays": 75,
			"detectedTechFirstSeen": {
				"deno": "2026-06-11",
				"@sveltejs/kit": "2026-06-11",
				"svelte-5": "2026-08-26",
				"vite": "2026-06-11"
			}
		},
		"cogni": {
			"commitHead": "6ce298e",
			"commitsAny": 26,
			"commitsAnyRecent": 0,
			"commitsMe": 26,
			"commitsMeRecent": 0,
			"commitAnyLast": "2026-08-25",
			"commitAnyRoot": "2026-03-14",
			"detectedLanguages": ["TypeScript", "Svelte", "HTML", "JavaScript"],
			"linesAny": 9942,
			"linesMeAdded": 14059,
			"linesMeRemoved": 3273,
			"linesAnyAdded": 14059,
			"linesAnyRemoved": 3273,
			"linesMeAddedRecent": 0,
			"linesMeRemovedRecent": 0,
			"linesAnyAddedRecent": 0,
			"linesAnyRemovedRecent": 0,
			"urlRepo": "https://github.com/JasonWarrenUK/cogni",
			"detectedRuntime": ["bun"],
			"detectedFramework": ["@sveltejs/kit", "svelte-5", "vite"],
			"measuredRef": "main",
			"detectedTechFirstSeen": {
				"bun": "2026-03-14",
				"@sveltejs/kit": "2026-03-14",
				"svelte-5": "2026-03-14",
				"vite": "2026-03-14"
			},
			"commitsHuman": 26,
			"authorsDistinct": 1,
			"authorsDistinctHuman": 1,
			"commitMeRoot": true,
			"commitMeLast": "2026-08-25",
			"spanMonthsActive": 3,
			"spanMonthsAll": 6,
			"spanGapMaxDays": 86
		},
		"commons-traybake": {
			"commitHead": "a0b3c6b",
			"commitsAny": 70,
			"commitsAnyRecent": 0,
			"commitsMe": 47,
			"commitsMeRecent": 0,
			"commitAnyLast": "2025-11-10",
			"commitAnyRoot": "2025-10-21",
			"detectedLanguages": ["TypeScript", "Svelte", "CSS", "HTML", "JavaScript"],
			"linesAny": 6566,
			"linesMeAdded": 6284,
			"linesMeRemoved": 270,
			"linesAnyAdded": 13482,
			"linesAnyRemoved": 534,
			"linesMeAddedRecent": 0,
			"linesMeRemovedRecent": 0,
			"linesAnyAddedRecent": 0,
			"linesAnyRemovedRecent": 0,
			"urlRepo": "https://github.com/fac-31/commons-traybake",
			"detectedRuntime": ["node"],
			"detectedFramework": ["@sveltejs/kit", "svelte-5", "express"],
			"detectedDatabase": ["neo4j-driver"],
			"measuredRef": "main",
			"detectedTechFirstSeen": {
				"@sveltejs/kit": "2025-11-07",
				"svelte-5": "2025-11-07",
				"express": "2025-11-03"
			},
			"commitsHuman": 69,
			"authorsDistinct": 9,
			"authorsDistinctHuman": 8,
			"commitMeRoot": true,
			"commitMeLast": "2025-11-06",
			"spanMonthsActive": 2,
			"spanMonthsAll": 2,
			"spanGapMaxDays": 8
		},
		"epoch": {
			"commitHead": "39b028b",
			"commitsAny": 60,
			"commitsAnyRecent": 0,
			"commitsMe": 29,
			"commitsMeRecent": 0,
			"commitAnyLast": "2026-08-25",
			"commitAnyRoot": "2024-05-17",
			"detectedLanguages": ["JavaScript", "Svelte", "HTML", "CSS"],
			"linesAny": 3849,
			"linesMeAdded": 1526,
			"linesMeRemoved": 8,
			"linesAnyAdded": 9342,
			"linesAnyRemoved": 1389,
			"linesMeAddedRecent": 0,
			"linesMeRemovedRecent": 0,
			"linesAnyAddedRecent": 0,
			"linesAnyRemovedRecent": 0,
			"urlRepo": "https://github.com/JasonWarrenUK/epoch",
			"detectedRuntime": ["node"],
			"detectedFramework": ["@sveltejs/kit", "svelte-5", "vite", "tailwindcss-4"],
			"measuredRef": "main",
			"detectedTechFirstSeen": {
				"@sveltejs/kit": "2026-03-04",
				"svelte-5": "2026-03-04",
				"vite": "2026-03-04",
				"tailwindcss-4": "2026-03-05"
			},
			"commitsHuman": 29,
			"authorsDistinct": 2,
			"authorsDistinctHuman": 1,
			"commitMeRoot": true,
			"commitMeLast": "2026-08-25",
			"spanMonthsActive": 5,
			"spanMonthsAll": 28,
			"spanGapMaxDays": 655
		},
		"fac-cra": {
			"commitHead": "649507fa",
			"commitsAny": 4096,
			"commitsAnyRecent": 0,
			"commitsMe": 320,
			"commitsMeRecent": 0,
			"commitAnyLast": "2026-04-02",
			"commitAnyRoot": "2026-02-11",
			"detectedLanguages": ["JavaScript", "TypeScript", "SQL", "Shell", "HTML", "CSS", "Python"],
			"linesAny": 213140,
			"linesMeAdded": 31500,
			"linesMeRemoved": 28614,
			"linesAnyAdded": 679282,
			"linesAnyRemoved": 383461,
			"linesMeAddedRecent": 0,
			"linesMeRemovedRecent": 0,
			"linesAnyAddedRecent": 0,
			"linesAnyRemovedRecent": 0,
			"urlRepo": "https://github.com/izaakrogan/fac-cra",
			"detectedRuntime": ["node"],
			"detectedFramework": ["express", "react", "vite", "next"],
			"detectedDatabase": ["pg", "graphql"],
			"measuredRef": "main",
			"detectedTechFirstSeen": {
				"express": "2026-02-05",
				"react": "2023-09-11",
				"vite": "2026-02-07"
			},
			"commitsHuman": 3558,
			"authorsDistinct": 16,
			"authorsDistinctHuman": 14,
			"commitMeRoot": false,
			"commitMeLast": "2026-03-27",
			"spanMonthsActive": 2,
			"spanMonthsAll": 2,
			"spanGapMaxDays": 6
		},
		"flyt": {
			"commitHead": "f1214cd",
			"commitsAny": 39,
			"commitsAnyRecent": 8,
			"commitsMe": 22,
			"commitsMeRecent": 8,
			"commitAnyLast": "2026-09-25",
			"commitAnyRoot": "2023-03-27",
			"detectedLanguages": ["Svelte", "TypeScript", "Shell", "HTML", "JavaScript", "CSS"],
			"linesAny": 3984,
			"linesMeAdded": 1634,
			"linesMeRemoved": 220,
			"linesAnyAdded": 9624,
			"linesAnyRemoved": 961,
			"linesMeAddedRecent": 707,
			"linesMeRemovedRecent": 218,
			"linesAnyAddedRecent": 707,
			"linesAnyRemovedRecent": 218,
			"urlRepo": "https://github.com/JasonWarrenUK/flyt",
			"detectedRuntime": ["node"],
			"detectedFramework": ["@sveltejs/kit", "svelte-5", "vite"],
			"measuredRef": "main",
			"detectedTechFirstSeen": {
				"@sveltejs/kit": "2026-03-08",
				"svelte-5": "2026-03-08",
				"vite": "2026-03-08"
			},
			"commitsHuman": 22,
			"authorsDistinct": 2,
			"authorsDistinctHuman": 1,
			"commitMeRoot": true,
			"commitMeLast": "2026-09-25",
			"spanMonthsActive": 5,
			"spanMonthsAll": 43,
			"spanGapMaxDays": 822
		},
		"grumble": {
			"commitHead": "4318b18",
			"commitsAny": 12,
			"commitsAnyRecent": 0,
			"commitsMe": 12,
			"commitsMeRecent": 0,
			"commitAnyLast": "2026-06-14",
			"commitAnyRoot": "2026-06-14",
			"detectedLanguages": ["Svelte", "TypeScript", "CSS", "HTML", "JavaScript"],
			"linesAny": 1618,
			"linesMeAdded": 2129,
			"linesMeRemoved": 88,
			"linesAnyAdded": 2129,
			"linesAnyRemoved": 88,
			"linesMeAddedRecent": 0,